{
  "schema_version": "1",
  "isms_p_version": "2023.11",
  "last_verified": "2026-05-10",
  "description": "Capability 카탈로그 v0.4 단계 1+2+3 시드. 스택 무관 보안 능력을 ISMS-P 통제와 controls.json/stacks 의 시그널 family 사이 중간 계층으로 정의한다. 단계 1 의 17개 + 단계 2 신설 5개 (governance, change_management, backup_recovery, patch_management, web_security) + 단계 3 신설 1개 (payment_integrity) = 총 23개. 단계 3 에서 stack profile family 매핑을 위해 기존 capability 에 신규 aspect 다수 보강 (authentication.anonymous_auth_review, application_access_control.app_layer_authn_present/oauth_redirect_uri_strict, data_minimization.pii_inventory/pii_in_logs_absent, web_security 의 헤더/CSP aspect 4종 등). satisfied_by_signal_families 의 family 명은 controls.json / stacks/official/*.json 에 실제 존재하는 family 와 일치한다. v0.5.0-B 부터 각 verification_aspect 에 applicable_to[] 메타 필드 추가 — 레포 역할(frontend/backend/fullstack/infra/mobile/all)별 평가 가능성 분리 (시그널 변경 0).",
  "capabilities": [
    {
      "id": "authentication",
      "name": "사용자 인증",
      "category": "identity",
      "description": "비밀번호 해싱·정책·MFA 정의 등 사용자 인증 메커니즘. 강한 해시 알고리즘, 약한 해시 부재, 비밀번호 정책 IaC, MFA IaC 조건 모두 검증한다.",
      "verification_aspects": [
        {
          "id": "strong_password_hashing",
          "description": "Argon2/bcrypt/scrypt 등 강한 패스워드 해시 사용 + MD5/SHA1 등 약한 해시 부재.",
          "satisfied_by_signal_families": [
            "password_hash_strong",
            "auth_weak_hash"
          ],
          "required": true,
          "evidence_hint": "비밀번호 저장 시 사용된 해시 라이브러리 코드와 마이그레이션 이력.",
          "applicable_to": [
            "backend",
            "fullstack",
            "all"
          ]
        },
        {
          "id": "app_level_mfa_implementation",
          "description": "애플리케이션 레벨 MFA 코드 (TOTP/SMS) 구현 흔적.",
          "satisfied_by_signal_families": [
            "mfa_app_code"
          ],
          "required": false,
          "applicable_to": [
            "backend",
            "fullstack",
            "all"
          ]
        },
        {
          "id": "iac_password_policy",
          "description": "IaC 에 비밀번호 정책 (길이/복잡도/만료) 정의.",
          "satisfied_by_signal_families": [
            "password_policy_present",
            "password_rotation_policy"
          ],
          "required": true,
          "applicable_to": [
            "backend",
            "infra",
            "fullstack",
            "all"
          ]
        },
        {
          "id": "iac_mfa_condition",
          "description": "IaC IAM 정책에 MFA 조건 (aws:MultiFactorAuthPresent) 명시 + 누락 부재.",
          "satisfied_by_signal_families": [
            "mfa_iac_present",
            "mfa_iac_missing"
          ],
          "required": false,
          "applicable_to": [
            "backend",
            "infra",
            "fullstack",
            "all"
          ]
        },
        {
          "id": "anonymous_auth_review",
          "description": "Firebase signInAnonymously 등 익명 인증 사용 검토 — 사용자 식별 불가 시 접근통제 정책 정합성 점검.",
          "satisfied_by_signal_families": [
            "firebase_anonymous_auth_enabled"
          ],
          "required": false,
          "applicable_to": [
            "frontend",
            "backend",
            "fullstack",
            "all"
          ]
        }
      ],
      "isms_p_relevance": [
        "2.5.3",
        "2.5.4"
      ]
    },
    {
      "id": "mfa_enforcement",
      "name": "MFA 강제",
      "category": "identity",
      "description": "콘솔/관리자 로그인 시 MFA 강제 여부. 런타임 검증 (`access_tier=2`) 과 IaC 정의 양쪽에서 확인한다.",
      "verification_aspects": [
        {
          "id": "runtime_mfa_console",
          "description": "런타임에서 콘솔 사용자 MFA 활성화 상태 확인.",
          "satisfied_by_signal_families": [
            "mfa_runtime"
          ],
          "required": true,
          "applicable_to": [
            "infra",
            "fullstack",
            "all"
          ]
        },
        {
          "id": "iac_mfa_condition",
          "description": "IaC 에서 MFA 조건이 IAM 정책에 명시.",
          "satisfied_by_signal_families": [
            "mfa_iac_present"
          ],
          "required": false,
          "applicable_to": [
            "backend",
            "infra",
            "fullstack",
            "all"
          ]
        },
        {
          "id": "root_account_hardening",
          "description": "Root 계정 보호 — MFA 활성 + 액세스 키 부재 + 미사용.",
          "satisfied_by_signal_families": [
            "root_account_runtime"
          ],
          "required": true,
          "applicable_to": [
            "infra",
            "fullstack",
            "all"
          ]
        }
      ],
      "isms_p_relevance": [
        "2.5.3"
      ]
    },
    {
      "id": "account_lifecycle",
      "name": "계정 라이프사이클",
      "category": "identity",
      "description": "계정 발급·회수·휴면 처리. 공용계정 부재, 휴면 액세스 키/콘솔 사용자 정리.",
      "verification_aspects": [
        {
          "id": "provisioning_logic",
          "description": "계정 발급/회수 로직 또는 자동화 흔적.",
          "satisfied_by_signal_families": [
            "account_lifecycle_logic"
          ],
          "required": false,
          "applicable_to": [
            "backend",
            "fullstack",
            "all"
          ]
        },
        {
          "id": "shared_account_absent",
          "description": "공용/공유 계정 사용 흔적 부재.",
          "satisfied_by_signal_families": [
            "shared_account"
          ],
          "required": true,
          "applicable_to": [
            "backend",
            "fullstack",
            "all"
          ]
        },
        {
          "id": "inactive_credentials_rotation",
          "description": "휴면 액세스 키/콘솔 사용자 정리 (정적 + 런타임).",
          "satisfied_by_signal_families": [
            "stale_access_key",
            "stale_access_key_runtime",
            "stale_console_user_runtime"
          ],
          "required": false,
          "applicable_to": [
            "infra",
            "fullstack",
            "all"
          ]
        }
      ],
      "isms_p_relevance": [
        "2.5.1",
        "2.5.6"
      ]
    },
    {
      "id": "access_control",
      "name": "권한 관리 (최소권한 / RBAC)",
      "category": "access",
      "description": "RBAC 데코레이터/미들웨어, IaC IAM 정의, 관리자 정책 미부여, 와일드카드 액션 부재. K8s ClusterRoleBinding 와일드카드 부재 포함.",
      "verification_aspects": [
        {
          "id": "rbac_decorators",
          "description": "애플리케이션에서 RBAC 가드/데코레이터 사용.",
          "satisfied_by_signal_families": [
            "rbac_usage"
          ],
          "required": false,
          "applicable_to": [
            "backend",
            "fullstack",
            "all"
          ]
        },
        {
          "id": "iac_iam_definition",
          "description": "IaC 에 IAM 정책/Role 명시적 정의.",
          "satisfied_by_signal_families": [
            "iam_iac_present"
          ],
          "required": false,
          "applicable_to": [
            "infra",
            "fullstack",
            "all"
          ]
        },
        {
          "id": "admin_policy_not_attached",
          "description": "AdministratorAccess / FullAccess 등 관리자 정책 부착 흔적 부재 (IaC + 런타임).",
          "satisfied_by_signal_families": [
            "iam_admin_attached",
            "iam_admin_runtime",
            "cdk_iam_admin_attached",
            "access_analyzer_runtime"
          ],
          "required": true,
          "applicable_to": [
            "infra",
            "fullstack",
            "all"
          ]
        },
        {
          "id": "wildcard_action_absent",
          "description": "IaC IAM 정책에 Action: '*' 와일드카드 부재.",
          "satisfied_by_signal_families": [
            "iam_wildcard",
            "pulumi_iam_wildcard"
          ],
          "required": true,
          "applicable_to": [
            "infra",
            "fullstack",
            "all"
          ]
        },
        {
          "id": "k8s_wildcard_absent",
          "description": "K8s ClusterRoleBinding/Role 의 와일드카드 verb/resource 부재.",
          "satisfied_by_signal_families": [
            "k8s_wildcard"
          ],
          "required": true,
          "applicable_to": [
            "infra",
            "fullstack",
            "all"
          ]
        },
        {
          "id": "inline_iam_review",
          "description": "CDK/Pulumi inline IAM grant 등 인라인 권한 부여 검토 (정보용).",
          "satisfied_by_signal_families": [
            "iac_inline_iam",
            "cdk_inline_iam_grant"
          ],
          "required": false,
          "applicable_to": [
            "infra",
            "fullstack",
            "all"
          ]
        },
        {
          "id": "metadata_service_protected",
          "description": "EC2 인스턴스 메타데이터 서비스 (IMDSv2) 강제 — 토큰 필수.",
          "satisfied_by_signal_families": [
            "ec2_imdsv2_runtime"
          ],
          "required": false,
          "applicable_to": [
            "infra",
            "fullstack",
            "all"
          ]
        }
      ],
      "isms_p_relevance": [
        "2.5.5",
        "2.6.2"
      ]
    },
    {
      "id": "application_access_control",
      "name": "응용프로그램 접근통제",
      "category": "access",
      "description": "Lambda Function URL 인증, Next.js 미들웨어 등 응용 레벨 접근 통제.",
      "verification_aspects": [
        {
          "id": "function_url_authenticated",
          "description": "Lambda/SST Function URL 이 NONE 인증으로 노출되지 않음.",
          "satisfied_by_signal_families": [
            "lambda_url_no_auth",
            "sst_function_url_unauthenticated",
            "cf_workers_route_open",
            "lambda_function_url_runtime"
          ],
          "required": true,
          "applicable_to": [
            "backend",
            "fullstack",
            "all"
          ]
        },
        {
          "id": "middleware_present",
          "description": "Next.js 등 프레임워크 미들웨어로 인증/인가 게이트 존재.",
          "satisfied_by_signal_families": [
            "nextjs_middleware_present",
            "app_auth_middleware_present"
          ],
          "required": false,